id,subreddit,created_datetime,full_clean_text
ablzuq,AskReddit,2019-01-01 21:06:27,people who havent pooped in yet why are you still holding on to last years shit 
l7530r,AskReddit,2021-01-28 18:51:22,how would you feel about reddit adding nsfw filters to distinguish between porn gore and repetitive posts asking how you would feel about reddit adding nsfw filters to distinguish between porn and gore 
f08dxb,AskReddit,2020-02-07 09:53:32,would you watch a show where a billionaire ceo has to go an entire month on their lowest paid employees salary without access to any other resources than that of the employee what do you think would happen 
iwedc5,AskReddit,2020-09-20 14:01:51,what if god came down one day and said its pronounced jod then left 
draola,AskReddit,2019-11-04 01:57:46,how would you feel about a feature where if someone upvotes a crosspost the original post is upvoted automatically 
kr8op6,AskReddit,2021-01-05 21:47:54,how would you feel about a if you accidentally scroll to the top you can go back to where you were button for reddit 
9whgf4,AskReddit,2018-11-12 19:54:27,stan lee has passed away at years old as many of you know today is day that many of us have dreaded stan lee has passed away at the age of he leaves behind a legacy of superheroes and stories that have touched many peoples lives for decades we wanted to make this thread to honor and remember this wonderful man so please use it discuss his life his work his cameos etc and what they meant to you excelsior the askreddit mods
9gx68l,AskReddit,2018-09-18 18:01:18,reddit how would you feel about a law that bans radio stations from playing commercials with honkingbeepingsiren noises in them 
himsju,AskReddit,2020-06-30 12:53:42,bill gates said i will always choose a lazy person to do a difficult job because a lazy person will find an easy way to do it whats a reallife example of this 
kka536,AskReddit,2020-12-26 01:41:25,what if earth is like one of those uncontacted tribes in south america like the whole galaxy knows were here but theyve agreed not to contact us until we figure it out for ourselves 
dcxylq,AskReddit,2019-10-03 22:00:30,anthony bourdain once said theres a guy in my head and all he wants to do is lay in bed all day long smoke pot and watch old movies and cartoons my life is a series of strategems to avoid and outwit that guy who is that guy for you and what do you do to avoid him 
q18zrj,AskReddit,2021-10-04 16:30:05,how is everyone enjoying reddit while instagram facebook and whatsapp are all down 
i4r81a,AskReddit,2020-08-06 12:49:57,its more than likely that covid will still be around at christmas time how are we going to explain to kids that santa is still allowed to go into millions of houses 
99eh6b,AskReddit,2018-08-22 15:50:56,without saying what the category is what are your top five 
ecscwk,AskReddit,2019-12-19 12:10:59,what free things online should everyone take advantage of 
80phz7,AskReddit,2018-02-27 19:53:47,with all of the negative headlines dominating the news these days it can be difficult to spot signs of progress what makes you optimistic about the future 
ilcknh,AskReddit,2020-09-02 18:35:36,steve irwin has you pinned down in a headlock what cool facts does he tell the audience about you and your habitat 
aicgpz,AskReddit,2019-01-21 17:38:11,serious americans would you be in support of putting a law in place that government officials such as senators and the president go without pay during shutdowns like this while other federal employees do why or why not 
ac9038,AskReddit,2019-01-03 19:12:23,iceland just announced that every icelander over the age of automatically become organ donors with ability to opt out how do you feel about this 
kkmgzr,AskReddit,2020-12-26 17:44:57,with christmas days away people who already have their decorations up why 
hvsxty,AskReddit,2020-07-22 12:32:05,which legendary reddit post comment can you still not get over 
jpfqtc,AskReddit,2020-11-06 23:14:33,you go to sleep on the st of december and wake up the next day but when you check your phone it says january st after the first couple of days you realize its just like groundhog day what do you do with the information you have about 
70k2ya,AskReddit,2017-09-16 23:12:16,how would you feel about a law that requires people over the age of to pass a specialized driving test in order to continue driving 
dtmyxw,AskReddit,2019-11-08 22:27:22,now that pbs has announced theyll be televising the impeachment hearings what will the drinking game rules be 
ejfvct,AskReddit,2020-01-03 14:10:06,the pope slapped a woman on day of world war iii is trending on day what will happen on day 
jp8bdq,AskReddit,2020-11-06 16:35:52,if reddit were to add an nsfl flair so that we could tell the difference between nsfw porn and nsfl gore and stuff do you think it would be useful why or why not 
f60oog,AskReddit,2020-02-18 23:05:12,how would you feel if the only thing we knew about presidential candidates was their stance on issuesno information on party name gender race or religious beliefs or lack thereof 
jg4rw0,AskReddit,2020-10-22 17:58:23,turns out is just a bizarre and unprecedented as except its all good things that keep happening what are they 
grst2b,AskReddit,2020-05-27 21:30:10,police officers of reddit what are you thinking when you see cases like george floyd 
n128oc,AskReddit,2021-04-29 11:25:32,people who have only fans what is stopping you from upgrading to an air conditioner 
h8d0k0,AskReddit,2020-06-13 18:38:39,how would you feel about a return to where you left off button for reddit 
l2d1la,AskReddit,2021-01-22 01:38:36,at tonight it will be the st minute of the st hour of the st day of the st year of the st century what will you be doing 
84anfy,AskReddit,2018-03-14 04:26:14,professor stephen hawking has passed away at the age of we have lost one of the greatest minds in history today as professor stephen william hawking has passed away on march at the age of it is a terrible loss and we wanted to create this thread for people to share their thoughts about professor hawking from favorite quotes to theories to whatever he and his work meant to you we also would recommend checking out the ama he did a couple of years agorsciencecommentsnyniscience_ama_series_stephen_hawking_ama_answers additionally here is a link to his official website edit we are also including a link to the stephen hawking foundation in case anyone is interested in donating in honor of his memory the stephen hawking foundation was established on the initiative of professor stephen hawking to facilitate research into cosmology astrophysics and fundamental particle physics both at school and university level it will also facilitate and support work relating to motor neurone disease and those living with the disease
hvbvpz,AskReddit,2020-07-21 17:38:11,what life changing item can you buy for less than 
gk8t35,AskReddit,2020-05-15 13:08:31,george carlin said think of how stupid the average person is and realize half of them are stupider than that what real life example have you seen that validates this view 
d0jjc2,AskReddit,2019-09-06 17:13:08,the s decade will be over in months what do you think people will remember this decade for 
k18dam,AskReddit,2020-11-26 04:31:32,how do you cope with being treated like you are crazy for following covid safety guidelines when others around you arent doing the same 
yiazab,AskReddit,2022-10-31 12:44:00,would you support a mandatory retirement age of for us house us senate us supreme court justices and if not why 
mlczdu,AskReddit,2021-04-06 14:31:23,youre offered the ability to absorb the knowledge of any book you touch instantly but the way it works is that time freezes and wont unfreeze until you finish reading the book cover to cover do you accept this powercurse why or why not 
euoqp6,AskReddit,2020-01-27 14:40:02,girls who took notes using different colored pens where are you now do you still continue to write using all those colors 
foslu3,AskReddit,2020-03-25 15:52:37,if covid wasnt dominating the news right now what would be some of the biggest stories be right now 
hsirrq,AskReddit,2020-07-16 21:26:18,what is something free from the internet everyone should take advantage of 
awmdb2,AskReddit,2019-03-02 21:05:56,you have just been cheated out of for a stupid brick how do you take revenge 
f4p0yw,AskReddit,2020-02-16 10:36:21,a new dating app is launched instead of a photo of the person it shows you a photo of their bedroom car kitchen shoes how they have their teacoffee things like that what photo would tell you the most about someone and would you be most interested to see to choose a potential date 
atn6h6,AskReddit,2019-02-22 21:34:44,you gain control of jk rowlings twitter account for a day what unnecessary piece of information do you add to harry potter lore 
ejr5rg,AskReddit,2020-01-04 03:47:13,african proverb says the child who is not embraced by the village will burn it down to feel the warmth what time in your life have you been closest to starting the fire 
e18g6m,AskReddit,2019-11-25 01:26:07,if ok boomer was a digital assistant like ok google what sorts of answers would it give you to certain questions 
kxbzv3,AskReddit,2021-01-14 18:51:41,former flat earthers what made you come round 
i3dk8c,AskReddit,2020-08-04 05:31:47,how would you feel if the us government made the day for voting a holiday 
8pks1u,AskReddit,2018-06-08 15:25:01,suicide prevention megathread with the news today of the passing of the amazing anthony bourdain and the also the very talented kate spade a couple of days of ago we decided to create a megathread about suicide prevention so many great and talented people have left the world by way of suicide not just those are famous but friends and family members of everyday people thats why we would like to use this thread for those that have been affected by the suicide of someone to tell your story or if you yourself have almost ended your life tell us about what changed if you are currently feeling suicidal wed like to offer some resources that might be beneficial has global resources and hotlines uk au please be respectful and remember the human while participating in this thread and thank you to everyone that chooses to share their stories the askreddit moderators
fcnqpg,AskReddit,2020-03-03 02:34:44,if instead of rebooting movies retelling them from a different point of view became popular which movie would you like retold 
mdlbrp,AskReddit,2021-03-26 10:04:35,how the f do you make friends as an adult if you dont drink 
jx6m5s,AskReddit,2020-11-19 17:08:30,doctors of reddit whats it like when you go in for a doctors appointment do you and your doctor discuss whats wrong with you like its a group project do you not go at all because youre your own doctor 
f937om,AskReddit,2020-02-25 02:44:55,what is the coolest website youve visited that no one knows about 
lec25l,AskReddit,2021-02-07 01:26:27,how would you feel about a tv show similar to undercover boss but instead of companies they secretly infiltrate and film police forces 
h9jasg,AskReddit,2020-06-15 16:11:52,if you had the ability to instantly give any person an orgasm simply by pointing your hand at them like a finger gun and saying pew how would you wield this power 
bekeb1,AskReddit,2019-04-18 11:26:19,what mindblowing but simple facts would satisfy a year old daughters daily request for fact before bedtime 
ew09zv,AskReddit,2020-01-30 05:15:10,it has now been days since the year how will you celebrate this monumental day 
cnhcty,AskReddit,2019-08-08 05:45:10,people who downloaded their google data and went through it what were the most unsettling things you found out they had stored about you 
js8e1z,AskReddit,2020-11-11 13:46:31,therapists of reddit what was your biggest i know im not supposed to judge you but holy sht moment 
hzdh0g,AskReddit,2020-07-28 12:05:48,what do you know is true without evidence what are you certain of right down to your bones without proof 
ivici8,AskReddit,2020-09-19 00:42:12,ruth bader ginsburg us supreme court justice passed at as many of you know today ruth bader ginsburg passed away at she was affectionately known as notorious rbg she joined the supreme court in under bill clinton and despite battling cancer times during her term she faithfully fulfilled her role until her passing she was known for her progressive stance in matters such as abortion rights samesex marriage voting rights immigration health care and affirmative action
m1iyga,AskReddit,2021-03-09 23:05:26,how would you feel if reddit added a feature where you could still use your normal account but then have an option to press a button on your account and post anonymously rather then creating a throwaway 
f1irzw,AskReddit,2020-02-10 01:27:41,people who can fall asleep within seconds of their head hitting their pillow how the fuck do you fall asleep within seconds of your head hitting your pillow 
l6o4jb,AskReddit,2021-01-28 04:38:23,how would you feel about school taking up an extra hour every day to teach basic adult stuff like washing clothes basic cooking paying taxes 
izk9gh,AskReddit,2020-09-25 14:19:32,what was the best you have no power here moment you have ever seen 
eic8yl,AskReddit,2020-01-01 01:44:27,youre given the option to drop what you have and return to as yourself at that age but with the extra years of experience do you take it why or why not 
myeqin,AskReddit,2021-04-25 18:49:31,as a year old you are offered the chance to live rentfree in a retirement or nursing home with the caveat that you must make an effort to spend at least a few hoursday with the other residents sharing meals hanging out etc would you take this opportunity and why or why not 
depwkk,AskReddit,2019-10-07 21:15:47,what looks easy peasy lemon squeezy but is actually difficult difficult lemon difficult 
hjwnge,AskReddit,2020-07-02 13:05:50,what are some methods you can use to protect your lemon tree from the lemon stealing whores 
imz8ly,AskReddit,2020-09-05 10:59:05,australians of reddit since no peace treaty has been signed to officially conlude the emu war how has life in this constant state of war been for you 
afzfa7,AskReddit,2019-01-14 19:35:46,admins of reddit whats your favorite subreddit 
gvj9a9,AskReddit,2020-06-03 00:14:04,i cant breathe black lives matter as the gap of the political divide in our world grows deeper we would like to take a few minutes of your time or express our support of equal treatment equal justice to express solidarity with groups which have been marginalized for too long and to outright say black lives matter the askreddit moderators have decided to disable posting for minutes and seconds the time george floyd was held down by police and we will lock comments on front page posts our hope is that people reading this will take a moment to pause and reflect on what can be done to improve the world this will take place at pm cdt askreddit is a discussion forum with which we want to encourage discussion of a wide range of topics now more than ever its important to talk about the topics that divide us and use askreddit to approach these conversations with open minds and respectful discussion this is also an important opportunity to reiterate our stance on moderation simply put we believe its our duty to ensure neutral and fair moderation so people with opposing views can use our platform as a place to have these important and much needed discussions about their views our hope being that the world will benefit as a result we feel that it is our duty to make sure that askreddit is welcoming to all to that end we have a set of rules to ensure posts encourage discussion and to ensure users feel safe welcome and respected as always blatant statements of racism or any other kind of bigotry will not be tolerated we want users to be able to express themselves and their views remember that everyone here and everyone you see in the news are human beings too with all of that in mind we reiterate our encouragement for people to discuss these hard and often uncomfortable topics as a way to find alignment unity and to progress as a society we ask that you take a few minutes to research a charity that aligns with your beliefs or a cause you care about and that you donate to it if youre able rolling stone put together a lot of links to different funds across many states if you would like to use this as a place to start the askreddit mods
kw6dfk,AskReddit,2021-01-13 01:59:37,martin luther king jr said if you cant fly then run if you cant run then walk if you cant walk then crawl but whatever you do you have to keep moving forward what are your life examples of this 
jb1el5,AskReddit,2020-10-14 14:12:09,women of reddit what do you think about the fall of constantinople in by the ottoman forces led by mehmed ii 
d5ye2u,AskReddit,2019-09-18 14:13:59,when youre lying in bed at night do you ever randomly remember some relatively minor social missteps or poorly chosen words you didsaid years earlier and then beat yourself up over it even though it really wasnt a big deal if so what happened 
eio3qj,AskReddit,2020-01-01 21:29:59,how would you feel about a ban of how would you feel questions on the sub 
i6jmrl,AskReddit,2020-08-09 13:50:16,whats your favorite poverty meal that you still eat regardless of where you are financially 
mje9y7,AskReddit,2021-04-03 18:30:15,how do you feel about how would you feel posts being banned weve gotten a lot of feedback on this one a lot of feedback weve all seen the how would you feel about ____ in which the op is just posting what is considered a shower thought which is aimed to ask users to support a largely popular concept in a way that fits askreddits rules interesting and engaging titles are always great but these posts dont have much discussion value which is the purpose of this sub because of this and due to the feedback weve received weve decided to remove these posts moving forward we do understand that theres some nuance to this some posts are shower thoughtsideas and others are actual discussion questions for example how would you feel about a if you accidentally scroll to the top you can go back to where you were button for reddit is really just a feature suggestion how would you feel about dating someone that makes a lot more money than you is a discussion question our philosophy in askreddit is to keep rules as objective as possible because it helps ensure fairness and consistency in moderation without allowing for a moderators personal discretion to interfere in the practice of removing or approving content however we also recognize that blanket bans on the phrasing of a question does not always accurately work to meet the spirit of the rules if you feel your how would you feel post promotes elaborate discussion and is not a rhetorical idea or limiting question feel free to modmail us a link and well be happy to manually review thank you to the users who modmailed us feedback asking for this policy we always appreciate constructive feedback and we do take every bit of feedback into consideration if you or anyone you know has been diagnosed with mesothsorry wrong scriptif you have feedback for us we always appreciate it as we want to give people the best experience in askreddit with love the ass credit mods
j5xvbi,AskReddit,2020-10-06 03:22:27,youre gifted straight hours where you and your pets are suddenly able to understand each other and have real conversations like youre old bffs just catching up on lost time what would you want to tell them and how would you want to spend those hours with them 
ikm2fo,AskReddit,2020-09-01 15:12:48,if people used break up lines instead of pick up lines what would some of them be 
iy790n,AskReddit,2020-09-23 09:58:44,you cant time travel but your phone has the internet from years in the future what do you search for first 
af3x54,AskReddit,2019-01-12 04:28:56,what do you think is the single greatest photograph in history 
4nqnrm,AskReddit,2016-06-12 15:19:33,breaking news orlando nightclub massshooting update pm est updated links below update pm est man with weapons explosives on way to la gay pride event arrested over people have been killed and over more injured at a gay nightclub in orlando fl cnn link to story use this thread to discuss the events share updated info etc please be civil with your discussion and continue to follow raskreddit rules helpful info orlando hospitals are asking that people donate blood and plasma as they are in need theyre at capacity come back in a few days though theyre asking below are some helpful links link to blood donation centers in florida american red cross onebloodorg currently unavailable call redcross or donate thanks ujeimsie for the additional links fbi tip line callfbi families of victims needing info official hotline donations equality florida has a gofundme page for the victims families theyve confirmed its their gfm page from their facebook account reddit live thread
bc6skn,AskReddit,2019-04-11 23:36:43,do you ever look at yourself one day and think you are hot as shit but the next day comes and youve become quasimodo why do you think this happens 
7pblps,AskReddit,2018-01-10 00:15:20,what are some slang terms a year old dad can say to his daughter to embarrass her 
lwstap,AskReddit,2021-03-03 12:32:26,elon musk is now worth billion how do we sell him 
itsi5i,AskReddit,2020-09-16 09:52:09,youre cursed with the ability to see ghosts but you can only see either a sexy ghosts that are constantly trying to get you hard at all times you cant feel anything or b smart ghosts that always correct you in a condescending way to make you feel stupid which do you choose and why 
d9fy8u,AskReddit,2019-09-26 06:45:54,the words low battery appear right before your eyes you take off your vr headset and realized your whole life was just a vr simulation which youve been playing for only a few minutes how do you react 
99362t,AskReddit,2018-08-21 13:33:30,what do you think buzzfeed employees worked on while reddit was down yesterday 
imbb4r,AskReddit,2020-09-04 06:59:06,what do you think of the idea of adopting elderly people whose children have died as parents or grandparents much the same way we adopt children whose parents have died as our own 
eccwli,AskReddit,2019-12-18 13:53:39,you are given a baby on your first birthday the child turns out to be you as a baby raising him wont change your life only his how would you raise this child to give it a better life than the one you have 
etcyd6,AskReddit,2020-01-24 16:49:12,of suicide rates world wide are men what can we do to help them 
ezyz1f,AskReddit,2020-02-06 20:59:07,how would you feel about at least one presidential primary debate being replaced with a historycivics themed contest of jeopardy between the candidates 
kttvdy,AskReddit,2021-01-09 16:24:54,what are subtle red flags at a job interview that say working here would suck 
ts82um,AskReddit,2022-03-30 14:46:44,chris rock is performing a standup gig tonight in bostonhis first appearance since the oscars if you were chris what would be the first joke youd tell assuming youd want to acknowledge will smiths slap 
f2wokf,AskReddit,2020-02-12 19:36:23,waiters what valentine day disasters have you witnessed 
jab3wa,AskReddit,2020-10-13 10:58:48,redditors who work at remote places like forest officers oil rig workers etc what creepy things have you noticed while at work 
fery8u,AskReddit,2020-03-07 07:33:33,in pornhub released statistics that showed step porn is trending downwards worldwide but hentai is rising especially in russia how can we use this information to foster world peace 
chm4um,AskReddit,2019-07-25 10:53:44,have you ever felt you dont knowhave forgotten who you really are that youve spent years just adapting to surroundings to make life easier and dont know whats the real you anymore if so how did you overcome this 
ghmr3e,AskReddit,2020-05-11 12:37:14,people who are and happy with their life what is your advice to people in their s 
iawfi3,AskReddit,2020-08-16 17:28:05,years ago pirates were a terrifying force to be reckoned with now theyre family friendly figures of fun what will be their modern day equivalent a few centuries from now 
cuctl4,AskReddit,2019-08-23 11:53:20,what if you suddenly feel a touch on the shoulder following with the words are you sleeping during my class you open your eyes and you are at your th grade math class all of the life leading up to this point was just a dream and you are a th grader what are your thoughts 
odkp21,AskReddit,2021-07-04 13:42:10,have you ever been drunk or high and came up with this truly amazing idea but then became sober and realized it wasnt as amazing as you thought it was if so what was the idea 
drl6m8,AskReddit,2019-11-04 17:47:46,which celebrity gives you the quickest boner once you look at them 
hs87fm,AskReddit,2020-07-16 11:50:02,straight men of reddit what is the strangest thing you have been told not to do because thats gay 
n34b7f,AskReddit,2021-05-02 11:19:41,serious therapists what is something people are afraid to tell you because they think its weird but that youve actually heard a lot of times before 
dh3xew,AskReddit,2019-10-13 01:16:42,whats the best kept secret on the internet 
hy77f0,AskReddit,2020-07-26 13:48:28,serious people of reddit who have gone through or are going through cancer what was the first sign that made you go to the doctor 
lg4q3m,AskReddit,2021-02-09 14:42:34,people who take massive war crime level dumps in public bathrooms but dont flush why 
i1sh57,AskReddit,2020-08-01 13:48:04,what is the greatest comeback to a insult youve ever heard 
e7k78g,AskReddit,2019-12-07 21:25:54,to every redditor who feels lonely hi how was your day 
jk9jpe,AskReddit,2020-10-29 12:59:06,what if isnt the bad year but its the start of a bad decade 
kjy2rj,AskReddit,2020-12-25 12:10:42,who ruined your family christmas this year and what did they do 
