id,subreddit,created_datetime,full_clean_text
i9o4h0,todayilearned,2020-08-14 15:34:15,til dave grohl wrote and recorded an entire album by himself singing and playing each instrument in the studio he chose the name foo fighters to hide his identity after a record label picked it up he needed to recruit members to perform the songs live thus the foo fighters were created 
mtxshb,todayilearned,2021-04-19 10:35:19,til that in a man received a check for as junk mail jokingly he deposited it into his account the check met all of the legal criteria for a check and was cashed 
1k9mdxw,AskReddit,2025-04-28 03:44:34,what is a sign someone is a pseudo intellectual 
1k9mdsv,AskReddit,2025-04-28 03:44:20,if actors could cover roles like singers do songs who would you like to see in which role 
1k9md2u,AskReddit,2025-04-28 03:43:10,what is your favorite quote 
1k9mcup,AskReddit,2025-04-28 03:42:50,what did you eat during your worst binge eating episode in one sitting 
1k9mct1,AskReddit,2025-04-28 03:42:45,what is your best unconventional tips tricks or advice for living alone as a year old 
1k9mcm8,AskReddit,2025-04-28 03:42:30,was jfk assassinated by cia why 
1k9mc9e,AskReddit,2025-04-28 03:41:57,noncalifornians what are californians known for 
1k9mb5u,AskReddit,2025-04-28 03:40:14,who will win the nba championship 
1k9mak9,AskReddit,2025-04-28 03:39:17,whats happening with democrats are they complicit of trump to some extent 
1k9ma1h,AskReddit,2025-04-28 03:38:27,whats the best way to really get over anxiety 
1k9m92q,AskReddit,2025-04-28 03:36:51,gen xers what was your reaction when mr roboto took off his mask revealing himself to be kilroy 
1k9m8h5,AskReddit,2025-04-28 03:35:55,whats the coziest lightsturneddown tuckedinblankets movie you know 
1k9m89r,AskReddit,2025-04-28 03:35:37,how do you feel about a potential porn ban 
1k9m825,AskReddit,2025-04-28 03:35:16,the name of your band has to be named after a historical figure whats the name of your band 
1k9m7sq,AskReddit,2025-04-28 03:34:53,why are you on this sub right now 
1k9m76u,AskReddit,2025-04-28 03:33:54,what was the best way you got away with cheating in school 
1k9m76c,AskReddit,2025-04-28 03:33:53,what was the best compliment someone has given you that still lives in your head and heart every day 
1k9m6yk,AskReddit,2025-04-28 03:33:31,if you were the president for only one daywhat would you do 
1k9m674,AskReddit,2025-04-28 03:32:18,what are the chances ppl you know actually randomly came across your profile and was able to identify its you based on your profile history on reddit 
1k9m30w,AskReddit,2025-04-28 03:27:28,maga what stuff does trump do that you disagree with or get pissed at 
1k9m5nz,AskReddit,2025-04-28 03:31:35,if you could make something go viral and become a trend what would it be 
1k9m5e8,AskReddit,2025-04-28 03:31:11,what is a small decision you made once that completely changed your life later 
1k9m526,AskReddit,2025-04-28 03:30:41,what are some respectful ways to encourage aging inlaws to talk about their endoflife decisions given their tendency to avoid the topic 
1k9m51n,AskReddit,2025-04-28 03:30:40,when did you realize you were seeing the one 
1k9m50d,AskReddit,2025-04-28 03:30:37,which city is more progressive new york city chicago or los angeles 
1k9m4yj,AskReddit,2025-04-28 03:30:33,what are the biggest dogged bullets in human history 
1k9m4lr,AskReddit,2025-04-28 03:30:04,how do you feel about the are we dating the same guy facebook groups 
1k9m4lc,AskReddit,2025-04-28 03:30:03,what is the approx quote what is god but the most powerful entity you know of from 
1k9m4bh,AskReddit,2025-04-28 03:29:37,what tragedy in history had the most impact on our lives today 
1k9m3vd,AskReddit,2025-04-28 03:28:51,what kind of peoplebehaviors are often mocked simply out of spite to be mean or feel powerful 
1k9m3ho,AskReddit,2025-04-28 03:28:13,what is something you randomly do and you dont know why 
1k9m3g4,AskReddit,2025-04-28 03:28:09,what tiktok sayingsslang do you hate or find the most annoying 
1k9m2um,AskReddit,2025-04-28 03:27:11,whats a quirky oddly specific habit or ritual youve developed that you secretly think makes your life better 
1k9m23w,AskReddit,2025-04-28 03:25:58,how magical was life in the s 
1k9m21i,AskReddit,2025-04-28 03:25:52,if you had a remote control for your bf gf wife husband what kind of settings would you have and how would you use it 
1k9m1u3,AskReddit,2025-04-28 03:25:35,whats the pettiest reason you broke upstopped dating someone 
1k9m1pt,AskReddit,2025-04-28 03:25:25,whats something legal that gives off massive this should be illegal vibes 
1k9m16p,AskReddit,2025-04-28 03:24:38,what flashback would have made a better movie than the movie itself was in 
1k9m0yf,AskReddit,2025-04-28 03:24:16,what are some ways that people fake competence or hide incompetence 
1k9m0sw,AskReddit,2025-04-28 03:24:02,if you were to come with a warning label what would it say 
1k9m0an,AskReddit,2025-04-28 03:23:16,how are you doing 
1k9m01g,AskReddit,2025-04-28 03:22:54,how did you successfully create your own business or product 
1k9lzb7,AskReddit,2025-04-28 03:21:41,death shows up in person he says hell answer any questions you have except for what happens after we die what happens in the future and how to live forever what would you ask 
1k9lz52,AskReddit,2025-04-28 03:21:24,what something small action changed your life forever 
1k9lybg,AskReddit,2025-04-28 03:20:07,whats the worst thing a parent ever saiddid to you 
1k9lxn7,AskReddit,2025-04-28 03:19:01,if someone gave you a million dollars to survive hours in a horror game which one would you pick and why 
1k9lx5x,AskReddit,2025-04-28 03:18:15,what was the first video game you ever played 
1k9lwsc,AskReddit,2025-04-28 03:17:39,how do you handle realizing that someone youve been friends with for years isnt the kind of person you want in your life anymore 
1k9lwrz,AskReddit,2025-04-28 03:17:39,what everyday thing feels way harder now than it did just a few years ago 
1k9lwlg,AskReddit,2025-04-28 03:17:21,whats something youve thought about as a str guy you feel you shouldnt have 
1k9lwh5,AskReddit,2025-04-28 03:17:11,what sport does the slang baller associate with 
1k9lw4p,AskReddit,2025-04-28 03:16:34,do you think streets fights are more entertaining than those on tv and why 
1k9lw0d,AskReddit,2025-04-28 03:16:23,whats a simple pleasure that never gets old no matter how many times you experience it 
1k9lvut,AskReddit,2025-04-28 03:16:10,you saw a boy spying on the popular jock with a notebook and when he notice you he said im not from the universe and im learning how social skills work so i could communicate and have friends how would you respond 
1k9lvlr,AskReddit,2025-04-28 03:15:46,what is the worst us city youve ever visited 
1k9lvlf,AskReddit,2025-04-28 03:15:45,what is a food though loved by whole world you cant stand it 
1k9lv1i,AskReddit,2025-04-28 03:14:54,how do you expose corruption in a tribal government if the state wont help 
1k9lu7p,AskReddit,2025-04-28 03:13:32,whats a toxic mindset people have that instantly makes them seem disgusting to you 
1k9lu45,AskReddit,2025-04-28 03:13:23,who would you like to big spoon or you to little spoon to sleep 
1k9ltrv,AskReddit,2025-04-28 03:12:50,whats your favorite clever insult 
1k9lt21,AskReddit,2025-04-28 03:11:41,what did you learn as a kid that took the longest to unlearn as you got older why 
1k9lsv9,AskReddit,2025-04-28 03:11:22,what is one of your strangest quirks 
1k9lsg9,AskReddit,2025-04-28 03:10:43,the first ever concert on the moon is just about to start what songsartists would you expect to hear 
1k9lrio,AskReddit,2025-04-28 03:09:20,grocery store workers what is the worst mistake you ever made at your job and what type of punishment did you receive 
1k9lrgb,AskReddit,2025-04-28 03:09:13,what is your best response to you suck 
1k9lr3h,AskReddit,2025-04-28 03:08:42,how does one do the wobble 
1k9lq5q,AskReddit,2025-04-28 03:07:12,do you find the popular chad so hard to relate to since there so prefect why or why not 
1k9lpsf,AskReddit,2025-04-28 03:06:39,people who immigrated to the us was it the right call 
1k9lp8n,AskReddit,2025-04-28 03:05:50,what is a massive thing someone will do that tells them you theyre not a good person 
1k9lnm9,AskReddit,2025-04-28 03:03:23,which country makes the best rice dish 
1k9lnlc,AskReddit,2025-04-28 03:03:21,whats your favorite video game and why 
1k9lnjf,AskReddit,2025-04-28 03:03:15,have you ever had a delivery that changed your perspective on life what happened 
1k9lncy,AskReddit,2025-04-28 03:02:59,lets say when you die you could see all your life statistics what would you look at first 
1k9ln4u,AskReddit,2025-04-28 03:02:38,if you could know one celebrities thoughts and actions for a day who would it be 
1k9ln1b,AskReddit,2025-04-28 03:02:28,whats a word that sounds beautiful if you ignore its meaning 
1k9llj1,AskReddit,2025-04-28 03:00:15,what is something a majority of america can agree on 
1k9ll5s,AskReddit,2025-04-28 02:59:41,if you could learn the absolute undeniable truth about one question in the universe but you could never tell anyone what you discovered what would you choose to know 
1k9ll4x,AskReddit,2025-04-28 02:59:38,who will be the first woman president of the us 
1k9lk62,AskReddit,2025-04-28 02:58:08,whats a question youve always wanted to ask but never found the right place to ask 
1k9ljvu,AskReddit,2025-04-28 02:57:41,whats that one dream you had that really shook you up 
1k9ljtj,AskReddit,2025-04-28 02:57:35,if you only had with hours to live no car no people to interact with and no access to drugs how would you spend those hours 
1k9ljt6,AskReddit,2025-04-28 02:57:34,what is the scammiest casino in america 
1k9ljnx,AskReddit,2025-04-28 02:57:20,whats your opinion on the canadian federal election tomorrow 
1k9ljnn,AskReddit,2025-04-28 02:57:20,what have you been putting off that you really must get done 
1k9livh,AskReddit,2025-04-28 02:56:01,what do you do and whats jobrelated question that will get you geeking out during small talk 
1k9lgw6,AskReddit,2025-04-28 02:52:54,people who dont work why and how do you pay to survive 
1k9lgh4,AskReddit,2025-04-28 02:52:16,whats something you realized way too late in life 
1k9lfu6,AskReddit,2025-04-28 02:51:15,how effective are detox drinks for benzos 
1k9len3,AskReddit,2025-04-28 02:49:24,lawyers of reddit whats the smallest rate you would charge someone 
1k9leaa,AskReddit,2025-04-28 02:48:53,what is something that everyone should be doing by the time they are in their s 
1k9ldw0,AskReddit,2025-04-28 02:48:18,to the other millennials how is life treating you honestly 
1k9ldr9,AskReddit,2025-04-28 02:48:05,whats your in a million coincidence 
1k9lde2,AskReddit,2025-04-28 02:47:31,what is infidelity for you 
1k9ld2t,AskReddit,2025-04-28 02:47:02,if there was a source that tracked controveries royal screw ups and criminal charges for both the republican and democratic party on a year by year basis in a simple layout would that make it easier for the least informed to finally determine who is the most competent party or is it irrelevant 
1k9lcx7,AskReddit,2025-04-28 02:46:48,what song are you listening to right this second 
1k9lcn0,AskReddit,2025-04-28 02:46:22,for those who bought a brandnew hybrid car how did you decide whether or not the extended warranty for years from the dealer was worth it what factors played a role in your decision 
1k9lbya,AskReddit,2025-04-28 02:45:20,what is one thing you would change about your life 
1k9l1ke,AskReddit,2025-04-28 02:29:35,what was the last award you received whats the story 
1k9lahq,AskReddit,2025-04-28 02:43:06,you find out youre stuck in a dream for all eternity whats the first thing you do 
1k9laac,AskReddit,2025-04-28 02:42:45,whats the most scandalous thing youve accidentally stumbled upon in someones search history 
1k9la9g,AskReddit,2025-04-28 02:42:42,whats your jam right now 
1k9l9yo,AskReddit,2025-04-28 02:42:14,whats youre omg they wouldnt believe this happened story etc ghost encounters celebrity encounters cheating death 
1k9l9br,AskReddit,2025-04-28 02:41:17,what is your fav god of war game 
1k9l92z,AskReddit,2025-04-28 02:40:54,what phrase did you hear only once but it stayed with you forever 
1k9l925,AskReddit,2025-04-28 02:40:52,how do you refer to yourself when talking to yourselfinternal dialogue 
1k9l8as,AskReddit,2025-04-28 02:39:44,your best friend becomes your username what do you do 
1k9l83c,AskReddit,2025-04-28 02:39:24,how many hours of tv do you watch what is an acceptable amount of tv time for you or your partner 
1k9l7mw,AskReddit,2025-04-28 02:38:39,what is something you wish you had known before joining the military 
1k9l7gj,AskReddit,2025-04-28 02:38:25,will you ever enter into politics for your countrystatecounty if no why if yes why 
1k9l77k,AskReddit,2025-04-28 02:38:01,pop music haters of reddit whats a pop song you actually love 
1k9l6l0,AskReddit,2025-04-28 02:37:02,women of reddit what qualities matter most to you when choosing a life partner 
1k9l6ie,AskReddit,2025-04-28 02:36:55,what movie doesnt get the respect you think it deserves 
1k9l6c1,AskReddit,2025-04-28 02:36:38,whats something you do ever day regardless of circumstances 
1k9l60j,AskReddit,2025-04-28 02:36:10,how did you stop overapologizing 
1k9l5mg,AskReddit,2025-04-28 02:35:34,widows and widowers of reddit do you still talk to your departed spouses about big or small things or ask them questions or for advice and if so what about 
1k9l5ak,AskReddit,2025-04-28 02:35:03,what do you guys find attractive in a woman 
1k9l58b,AskReddit,2025-04-28 02:34:57,whats a made up word you use a lot 
1k9l4sq,AskReddit,2025-04-28 02:34:21,what are your plans grand or tiny to make the world better 
1k9l4l0,AskReddit,2025-04-28 02:34:03,ice collateral damage how do you justify deporting legal immigrants and families in the hunt for undocumented people 
1k9l47w,AskReddit,2025-04-28 02:33:32,lets add some positivity to our feed today whats the best thing that has happened to your local community recently 
1k9l3vm,AskReddit,2025-04-28 02:33:01,what is reddits answer to the clear migrant issues going on in western nations 
1k9l3ug,AskReddit,2025-04-28 02:32:58,if you could give yourself years ago one piece of advice what would you tell yourself 
1k9l3oa,AskReddit,2025-04-28 02:32:42,what show are you binge watching right now 
1k9l3hf,AskReddit,2025-04-28 02:32:25,you wake up looking like your reddit avatar how screwed are you 
1k9l2qc,AskReddit,2025-04-28 02:31:19,what is the acts of service you most miss from your parents 
1k9l29a,AskReddit,2025-04-28 02:30:36,if aliens had a different visible light spectrum frequencies how would humans look like to them 
1k9l1wi,AskReddit,2025-04-28 02:30:02,what causes a lactation kink 
1k9l1ia,AskReddit,2025-04-28 02:29:30,whats your best way to avoid spam emails 
1k9l1gm,AskReddit,2025-04-28 02:29:25,whats an unspoken rule you follow that secretly makes life way easier 
1k9l1dc,AskReddit,2025-04-28 02:29:18,how can denizens of the internet start some grass roots political party to enact change is there a way that collectively we can force a path towards bettering the world 
1k9l0w6,AskReddit,2025-04-28 02:28:31,whats the best thing youve ever found secondhand 
1k9l07x,AskReddit,2025-04-28 02:27:30,whats the quickest way you have seen someone ruin their military career 
1k9kznm,AskReddit,2025-04-28 02:26:36,what immediately ruined the family reunion 
1k9kzjn,AskReddit,2025-04-28 02:26:27,whats the best decision you ever made 
1k9kz9h,AskReddit,2025-04-28 02:26:02,would making your children do exercise moves as punishment be considered wrong moves like planking or other difficult moves if no what other moves and exercises would you suggest 
1k9kz1g,AskReddit,2025-04-28 02:25:41,who was the first person in your life who died 
1k9kyer,AskReddit,2025-04-28 02:24:45,what are some laws that could help the worldyour country but requires too much faith in the government to have your best interest 
1k9kxyt,AskReddit,2025-04-28 02:24:04,whats a item you sold to fund your bad habits 
1k9kxj9,AskReddit,2025-04-28 02:23:24,former soldiers what is something you wish you had known before joining the military 
1k9kx4b,AskReddit,2025-04-28 02:22:46,what age is it cool to start smoking again cause we are going down hill anyway 
1k9kwrf,AskReddit,2025-04-28 02:22:11,the object directly next to you is your weapon to save the world how screwed is the earth 
1k9kwf4,AskReddit,2025-04-28 02:21:39,how do you expect the program to develop in the future 
1k9kukq,AskReddit,2025-04-28 02:18:50,whats your goto lazy dinner when you absolutely dont feel like cooking 
1k9kujd,AskReddit,2025-04-28 02:18:47,people who tried salvia a and b what were the trips like and how were they different 
1k9kud1,AskReddit,2025-04-28 02:18:30,trump supporters of reddit what would trump have to do for you to finally say okay he can go to jail 
1k9ku15,AskReddit,2025-04-28 02:17:59,what are some hobbies that are universally considered boring 
1k9kty8,AskReddit,2025-04-28 02:17:51,whats something your parents did when raising you that you will be repeating with your own children 
1k9ktaq,AskReddit,2025-04-28 02:16:53,what is the silliest thing a teacherprofessor of yours has banned 
1k9kt97,AskReddit,2025-04-28 02:16:49,what was the reason for your username 
1k9kt1l,AskReddit,2025-04-28 02:16:29,if you could have dinner with anyone dead or alive who would it be 
1k9kssk,AskReddit,2025-04-28 02:16:05,what irrational fear do you have that you think is fully justified 
1k9ks62,AskReddit,2025-04-28 02:15:11,what is the most embarrassing thing youve ever done 
1k9ks5h,AskReddit,2025-04-28 02:15:09,what is the modern day equivalent to the all your base meme 
1k9krms,AskReddit,2025-04-28 02:14:25,whats the best example of a simple machine usage youve ever seen 
1k9krim,AskReddit,2025-04-28 02:14:16,what are some unwritten social rules that everyone should followknow 
1k9kq8n,AskReddit,2025-04-28 02:12:21,ladies who did the break up you or him why did you end the relationship with a man you loved 
1k9kq6g,AskReddit,2025-04-28 02:12:16,what is something that you wish youd never know 
1k9kq5u,AskReddit,2025-04-28 02:12:15,are you a comforter duvet or sheet sleeper why 
1k9kpb8,AskReddit,2025-04-28 02:10:59,you just passed away but youre only allowed to be reborn something other than a humanwhat are u gonna be 
1k9koud,AskReddit,2025-04-28 02:10:18,whats the best thing you ever shoplifted 
1k9koq2,AskReddit,2025-04-28 02:10:07,how is moving out of your parents place after college is living alone a good idea 
1k9ko0h,AskReddit,2025-04-28 02:09:05,whats your guilty pleasure that might be seen as weird 
1k9knwy,AskReddit,2025-04-28 02:08:54,what would be the most illegal thing that average person would engage with if it became completely legal 
1k9kn9f,AskReddit,2025-04-28 02:07:55,fat guys how did you get big 
1k9kmun,AskReddit,2025-04-28 02:07:17,whats the most expensive meaningful thing youve ever lost and did you end up finding it 
1k9kmue,AskReddit,2025-04-28 02:07:16,what is something that youve been able buy before but cant buy now 
1k9kmjy,AskReddit,2025-04-28 02:06:51,whats something you thought would never happen to you but it did 
1k9kmf8,AskReddit,2025-04-28 02:06:40,tattoo artists of reddit what was your most pain staking project 
1k9kmeu,AskReddit,2025-04-28 02:06:39,whats one small decision a man can make today that will change his whole future 
1k9kmef,AskReddit,2025-04-28 02:06:38,what girls think about skinny guys with average size 
1k9klsa,AskReddit,2025-04-28 02:05:45,when was the last time you went shopping in a mall 
1k9klrb,AskReddit,2025-04-28 02:05:43,people who came out in a movie but didnt say a word what was it like 
1k9klcd,AskReddit,2025-04-28 02:05:07,with so many other other advances in auto safety how has big auto not fixed the rear view mirror blind spot issue not using cameras 
1k9kl8y,AskReddit,2025-04-28 02:04:59,where do you see yourself in years 
1k9kh1i,AskReddit,2025-04-28 01:58:53,whats the hardest truth that youve had to accept 
1k9kktr,AskReddit,2025-04-28 02:04:21,whats something men really need to talk about more but still stay silent 
1k9kknj,AskReddit,2025-04-28 02:04:06,what was the last core memory you thought you forgot but didnt 
1k9kkeh,AskReddit,2025-04-28 02:03:40,how scary do you think horror movies would be if the protagonist were a child assuming said movie had flawless execution 
1k9kk7d,AskReddit,2025-04-28 02:03:21,whats a life changing experience that happened to you 
1k9kk1y,AskReddit,2025-04-28 02:03:09,redditors outside the us what american food do you not like the taste of 
1k9kipn,AskReddit,2025-04-28 02:01:08,what are your worst movie recommendations 
1k9ki8h,AskReddit,2025-04-28 02:00:33,what are some subreddits that are informative 
1k9khrw,AskReddit,2025-04-28 01:59:56,italians who tried pineapple on pizza whats your honest opinion 
1k9khl4,AskReddit,2025-04-28 01:59:38,what food goes good with beans 
1k9khhu,AskReddit,2025-04-28 01:59:30,whats the most underrated skill that made your life way easier 
1k9khdh,AskReddit,2025-04-28 01:59:21,how would you feel about a colleague discretely praying silently before eating at a business function 
1k9kh9j,AskReddit,2025-04-28 01:59:12,what was the most memorable thing from your prom weekend 
1k9kh52,AskReddit,2025-04-28 01:59:02,if you could make love to any us president in their prime who would you choose and why 
1k9kgyh,AskReddit,2025-04-28 01:58:46,what is the worst instance of confirmation bias from someone youve ever encountered 
1k9kgt1,AskReddit,2025-04-28 01:58:33,how will you react if your gf prayed to god just to develop a crush on you 
1k9kgr0,AskReddit,2025-04-28 01:58:28,what do people do for their quarterlife prices 
1k9kgje,AskReddit,2025-04-28 01:58:11,what are some crazy subreddits to check out to pass some time 
1k9kgdc,AskReddit,2025-04-28 01:57:57,whats the best relationship advice you could give your younger self 
1k9kg86,AskReddit,2025-04-28 01:57:44,whats something people pretend is safety but is really about control 
1k9kfyf,AskReddit,2025-04-28 01:57:20,whats your favorite poetry piece in your opinion 
1k9kfpw,AskReddit,2025-04-28 01:57:00,what are the best freelancing platforms 
1k9kf2i,AskReddit,2025-04-28 01:56:03,what five things if put in a pentagram would summon you 
1k9kek4,AskReddit,2025-04-28 01:55:18,why wouldnt you join the military 
1k9kdvf,AskReddit,2025-04-28 01:54:17,what are your expierences with post nut clarity and do women get it to 
1k9kdck,AskReddit,2025-04-28 01:53:31,do you have a junk drawer in your home what kinds of things do you keep in there 
1k9kd5u,AskReddit,2025-04-28 01:53:15,whats a kids product that adults secretly love too 
1k9kd4i,AskReddit,2025-04-28 01:53:12,you are your username what are you 
1k9kc7d,AskReddit,2025-04-28 01:51:50,whats a hack you use on online games 
1k9kby2,AskReddit,2025-04-28 01:51:28,what is the sexiest nonsexual thing that somebody can do 
1k9kbj9,AskReddit,2025-04-28 01:50:48,what is a small life hack that makes your life easier 
1k9kb6w,AskReddit,2025-04-28 01:50:20,if you could go back what would you make your senior quote 
1k9ka8x,AskReddit,2025-04-28 01:48:52,for those of you who used to have anxietypanic attacks but dont anymore how did you overcome it 
1k9ka1h,AskReddit,2025-04-28 01:48:35,whats a secret kink youve never told anyone because youre scared theyd judge you 
1k9k9vv,AskReddit,2025-04-28 01:48:22,what childhood hobby did you have that your parents never understood 
1k9k9u4,AskReddit,2025-04-28 01:48:18,what are some misconceptions about the bible 
1k9k9oo,AskReddit,2025-04-28 01:48:05,whats your way of dealing with a bad day 
1k9k8u5,AskReddit,2025-04-28 01:46:53,what do you think is a good prebuilt gaming pc 
1k9k7wa,AskReddit,2025-04-28 01:45:31,what is something youve been advised not to do but you do it anyway 
1k9k785,AskReddit,2025-04-28 01:44:34,if you get one wish to become truecwhat would you ask for 
1k9k6vn,AskReddit,2025-04-28 01:44:04,what about rating cocks 
1k9k6iu,AskReddit,2025-04-28 01:43:35,if you had a personal robot assistant what would you have it do for you on a daily basis 
1k9k6dq,AskReddit,2025-04-28 01:43:22,what are some gallbladder surgery recovery must haves 
1k9k6a5,AskReddit,2025-04-28 01:43:13,psychologists of reddit what do you think of dr phil 
1k9k61e,AskReddit,2025-04-28 01:42:51,how do you stand up to a landlord without a lawyer and without getting evicted 
1k9k5x0,AskReddit,2025-04-28 01:42:40,how would cutting off the top of an ears helix the rimthing affect hearing 
1k9k5r4,AskReddit,2025-04-28 01:42:27,what organization do you not respect at all 
1k9k5ax,AskReddit,2025-04-28 01:41:44,whats something you thought was gross until you actually tried it 
1k9k5a6,AskReddit,2025-04-28 01:41:42,what makes men wanna ditch women out of nowhere 
1k9k4yz,AskReddit,2025-04-28 01:41:14,whats the dumbest reason humanity could go extinct 
1k9k4xt,AskReddit,2025-04-28 01:41:11,whats something in bed that you secretly hate but pretend to enjoy 
1k9k4c8,AskReddit,2025-04-28 01:40:17,whats your weirdest most random turnon that youre almost embarrassed to admit 
1k9k3x8,AskReddit,2025-04-28 01:39:36,whats an unwritten rule that everyone secretly follows but nobody talks about 
1k9k3v4,AskReddit,2025-04-28 01:39:31,to the people who live in montana whats it like 
1k9k3r7,AskReddit,2025-04-28 01:39:21,what leads some women to attract awful men 
1k9k3p6,AskReddit,2025-04-28 01:39:17,whats one thing youll never understand about people no matter how hard you try 
1k9k3jg,AskReddit,2025-04-28 01:39:04,when did you first recognize adolf hitler as evil 
1k9k39e,AskReddit,2025-04-28 01:38:40,whats something that instantly makes you lose respect for someone 
1k9k33t,AskReddit,2025-04-28 01:38:25,whats an unspoken rule of life that everyone should know by now but nobody talks about 
