id,subreddit,created_datetime,full_clean_text
1k34x6d,todayilearned,2025-04-19 19:59:52,til eliot indian bible it was the first bible translated into a native american language on the continent carried out by john eliot financed by the society for the propagation of the gospel in new england and with the help of natives cockenoe john sassamon job nesuton and james printer 
1k34k8f,todayilearned,2025-04-19 19:43:15,til grant imahara made a lifelike baby yoda robot to visit children in hospitals and cheer them up before he passed away 
1k34gp0,todayilearned,2025-04-19 19:38:41,til dogs are the most variable mammal on earth with over artificially selected dog breeds 
1k3407r,todayilearned,2025-04-19 19:17:45,til michelle branch was only the third choice vocalist for santanas the game of love she won over tina turner and macy gray 
1k33d6r,todayilearned,2025-04-19 18:49:08,til in a man taking shelter under a tree during a storm was struck by lightning which knocked him off his feet but before he hit ground he was struck by a second bolt of lightning however he never lost consciousness escaped with only minor injuries his doctors told him he was a miracle 
1k32hfw,todayilearned,2025-04-19 18:09:43,til that modern smartphones have times the processing power than the most powerful supercomputer in the world in the s 
1k31o44,todayilearned,2025-04-19 17:33:28,til that the date of easter used to be so complicated to calculate that church authorities would come up with algorithms to determine it years in advance disagreements over the proper algorithm led to eastern orthodox churches celebrating easter on a different date than western churches 
1k31k20,todayilearned,2025-04-19 17:28:26,til that in william armstrong invented the hydraulic crane using pressurized water instead of steam first used at newcastle docks it boosted efficiency and led to the hydraulic accumulatortech that laid the groundwork for modern hydraulic systems 
1k31cry,todayilearned,2025-04-19 17:19:41,til that the americas were named after italian explorer amerigo vespucci after german mapmakers mistakenly believed he discovered the continents 
1k30wmn,todayilearned,2025-04-19 17:00:26,til that in the early days of rail transport there was a railroad in california where passengers were required to get out and push the train up steep hills due to inadequate engine power 
1k2zzzl,todayilearned,2025-04-19 16:19:31,til albert einstein wrote a preface to the german edition of upton sinclairs mental radio book which explores telepathy and the authors experiments in psychic communication with his wife he wrote that the book deserves the most earnest consideration from psychologists 
1k2z9t6,todayilearned,2025-04-19 15:47:24,til that from king george iii was king of the anglocorsican kingdom which was captured during the french revolutionary wars and had a democratic constitution and elected parliament 
1k2z7mw,todayilearned,2025-04-19 15:44:46,til that the teachings of don juan and its sequels were submitted to the ucla department of anthropology as nonfictional accounts of shamanism in the american southwest they earned their author a phd the books were later discredited as fabrications 
1k2xm4c,todayilearned,2025-04-19 14:33:43,til that yo js bach taught rowdy older students and often clashed with them after calling one a nanny goat bassoonist the student responded by calling him a dirty dog and hit him with a stick bach drew his sword and pierced the students jacket only stopping when passersby rushed in 
1k2wnky,todayilearned,2025-04-19 13:47:47,til that apollo astronauts footprints on the moon may last for millions of years 
1k2weq8,todayilearned,2025-04-19 13:35:42,til that in paleontologists officially named a dinosaur dracorex hogwartsia meaning dragon king of hogwarts the skulls spiky appearance reminded them of the dragons described in the harry potter books however later research suggested it likely wasnt a separate species 
1k2vncn,todayilearned,2025-04-19 12:55:59,til paul revere was a master silversmith 
1k2vc1y,todayilearned,2025-04-19 12:38:48,til mike myers eddie murphy and cameron diaz negotiated an upfront payment of million each for voicing the sequel to shrek this was an increase from the each received for the first film also the three actors were expected to each work between hours in total on shrek 
1k2v2mo,todayilearned,2025-04-19 12:24:16,til that medieval cathedral exteriors were originally painted in vibrant colours 
1k2u77c,todayilearned,2025-04-19 11:32:14,til that year old dick van dyke had to be rescued by three neighbors after he was found crawling to his vehicle trying to evacuate a california wildfire last december 
1k2u11r,todayilearned,2025-04-19 11:21:12,til the shrimp industry removes the eyes of female shrimp to increase reproduction calling it eyestalk ablation 
1k2tqew,todayilearned,2025-04-19 11:02:00,til portuguese is most spoken language in the southern hemisphere 
1k2tppn,todayilearned,2025-04-19 11:00:55,til amazon use to make a smartphone called fire phone but it was discontinued due to poor functionality pricing and exclusive to purchase only through a att carrier contract 
1k2tml9,todayilearned,2025-04-19 10:55:12,til that classical music slows mice heart transplant rejection 
1k2ljvj,todayilearned,2025-04-19 01:58:49,til that in of all us households had at least one boarder compared to less than today if as many households had a boarder today it would provide enough housing for million people 
1k2qeb8,todayilearned,2025-04-19 06:59:18,til of michele mouton the last women to compete in high level rallying she won races in the season and nearly won the world rally championship season eventually finishing runner up as a factory driver for audi 
1k2qc7p,todayilearned,2025-04-19 06:55:18,til that thomas dolby ideated storyboarded the music video for his s hit she blinded me with science before he wrote the song after writing the song to fit his storyboards he subsequently directed its music video 
1k2nfho,todayilearned,2025-04-19 03:45:58,til during the filming of the godfather marlon brando refused to memorize his lines and would read them off cards attached anywhere from trees in the background to fellow actors 
1k2ndza,todayilearned,2025-04-19 03:43:28,til that paul von lettowvorbeck the respected commander of german forces in east africa during ww was offered a job by hitler in he told hitler to go fuck himself though other reports say he didnt put it that politely 
1k2kdia,todayilearned,2025-04-19 00:55:21,til that although charles dawson was implicated after his death for the piltdown hoax involving fabricating human remains he may have been involved in as many as forgeries these included falsifying roman artifacts by casting them in iron creating and planting fossils and forging stone stools 
1k2jf8b,todayilearned,2025-04-19 00:04:54,til that geospiza fortis one if darwins finches was the first animal species which scientists have observed evolving in realtime 
1k2ifa4,todayilearned,2025-04-18 23:14:27,til after defeating the french and capturing king francis in battle emperor charles v agreed to release francis in exchange for a treaty instead of invading france which led contemporaries like machiavelli to call him mad and a fool as soon as he was released francis annuled the treaty 
1k2hcw2,todayilearned,2025-04-18 22:23:17,til in mcdonalds opened their first drivethru to allow soldiers stationed at fort huachuca to order food at the time soldiers werent allowed to leave their vehicle while in uniform if they were offpost 
1k2fmtz,todayilearned,2025-04-18 21:05:17,til in a kayaker was trapped by a crocodile on an australian island for weeks each time he attempted to leave in his ft kayak the croc estimated to be more than twice that size would chase him block his exit a local man rescued him after investigating a light coming from the island 
1k2e1uk,todayilearned,2025-04-18 19:56:56,til that disney commissioned salvador dali to create an animated work that captured the essence of surrealism the production of destino began in but was shelved due to financial concerns the project was restarted by disneys nephew in more than years after it was first conceived 
1k2dx3b,todayilearned,2025-04-18 19:51:12,til the thunderbird diamond disaster occurred in at indian springs afb in arizona four jets flying in formation dropped down to ft at mph as part of a training session the lead jet had a malfunction and slammed into the ground and was followed by the other jets four officers died 
1k2dcie,todayilearned,2025-04-18 19:26:25,til about herorats southern giant pouched rats that are trained to detect and indicate landmine locations they are trained by nonprofit apopo they also have rats who are trained to detect tuberculosis 
1k2cn42,todayilearned,2025-04-18 18:56:07,til that frogs account for of extant amphibian species 
1k2bc4z,todayilearned,2025-04-18 18:01:23,til frank herberts dune was rejected by twenty publishers and was finally accepted by chilton which was primarily known for car repair manuals 
1k2ag77,todayilearned,2025-04-18 17:23:56,til the term contrafactum its when you change the lyrics but keep the melody of the original song examples include tom lehrers element song and the japanese version of auld lang syne 
1k2a536,todayilearned,2025-04-18 17:10:57,til that fenugreek a common ingredient in curries can make your urine and sweat smell like maple syrup 
1k2a0jl,todayilearned,2025-04-18 17:05:52,til the mothers of plaza de mayo formed as a human rights group in to protest the disappearance of argentine political prisoners that opposed military dictatorship during the dirty war they were actual mothers of children the government abducted 
1k29u0k,todayilearned,2025-04-18 16:58:42,til warner bros spent m developing the tim burtondirected superman lives with nicolas cage as the lead before canceling it in burton cited issues with jon peters i basically wasted a year a year is a long time to be working with somebody that you dont really want to be working with 
1k2960g,todayilearned,2025-04-18 16:30:46,til postmans park in london contains over plaques that honour individuals who died performing brave acts to save others like rescuing people from burning buildings saving children from drowning or shielding others from accidents 
1k27xs0,todayilearned,2025-04-18 15:39:05,til singer shaggys signature deep voice is not his real voice he used it in one song that became a hit and then had to keep using it 
1k278xb,todayilearned,2025-04-18 15:10:09,til about peter sinks a sink hole in utah at ft that is one of the coldest places in the us the temp was once recorded at f from the brim to the basin the temp can diff by as much as 
1k26ulz,todayilearned,2025-04-18 14:53:24,til it was said that frederick the great had a physical disgust of women he once shocked a dinner party with an offensive rant against ghastly women you smelled ten miles around when he saw his wife for the first time in six years he only told her madame has become more stout and then left 
1k26iqn,todayilearned,2025-04-18 14:39:03,til no other album from the s matches the streaming dominance and its ability to place multiple tracks in spotifys billions club than fleetwood macs rumors album 
1k26eip,todayilearned,2025-04-18 14:33:52,til about michael larson an icecream man who in appeared on the game show press your luck having memorized the five predetermined board cycles and after over spins won over and several holidays 
1k2693h,todayilearned,2025-04-18 14:27:12,til that in ancient rome some statues were designed with removable heads so the same body could represent different people this clever approach was especially useful when a new emperor came to power and needed to replace the image of a disgraced or rival predecessor 
1k25z73,todayilearned,2025-04-18 14:15:24,til ving rhames earned million for roughly seconds of screen time in mission impossible ghost protocol which makes him the highestpaid actor for the smallest amount of screen time he had just two days of work on set 
1k25nkr,todayilearned,2025-04-18 14:01:03,til the old cowboy song dont fence me in was based on text by robert fletcher a poet and engineer with the department of highways in helena montana it was songified by cole porter who bought the poem from fletcher for 
1k2562q,todayilearned,2025-04-18 13:39:02,til that in london model christine keeler had simultaneous affairs with british secretary of state john profumo and soviet naval attach yevgeny ivanov the scandal sparked fears of espionage rocked parliament and helped bring down the conservative party in 
1k24zxc,todayilearned,2025-04-18 13:30:56,til the good fences make good neighbors poem by robert frost called mending wall actually argues against fences says theyre unnatural and dont create good neighbors 
1k240vo,todayilearned,2025-04-18 12:43:51,til that in japan more diapers are now sold for elderly people than for babies reflecting the countrys aging population and shifting demographics 
1k23cuc,todayilearned,2025-04-18 12:08:35,til aretha williams was given up as a child and informally adopted by bailey and mary jane robinson at aretha became pregnant by bailey her adoptive father and gave birth to music legend ray charles after divorcing bailey mary jane helped raise ray alongside aretha 
1k238sq,todayilearned,2025-04-18 12:02:25,til the mass deformities reported in frogs during the s were primarily caused by a parasite infecting tadpoles 
1k22bo1,todayilearned,2025-04-18 11:09:30,til about the young eagles international flight program which has given millions of young people their first flight experience and helped produce thousands of licensed pilots former chairmen include aviation legends chuck yeager harrison ford and chesley sully sullenberger 
1k1zpfb,todayilearned,2025-04-18 08:08:57,til that during a dissociative fugue a person can suddenly travel far from home assume a new identity and live for days or even weeks without any memory of their former life 
1k1yktx,todayilearned,2025-04-18 06:48:16,til that until the s aboriginal children in australia were systematically taken from their families known as the stolen generations 
1k1xpm6,todayilearned,2025-04-18 05:50:00,til during hibernation arctic ground squirrels core body temperature reaches temperatures down to c f and the heart rate drops to one beat per minute 
1k1x64o,todayilearned,2025-04-18 05:14:19,til clouds are air and only water by volume even though they can weigh thousands of tons 
1k1wixo,todayilearned,2025-04-18 04:34:02,til that neptune isnt actually dark blue it appeared so in early photos because of image processing in reality its true color is similar to uranus light blue 
1k1wisi,todayilearned,2025-04-18 04:33:47,til that an entire award winning novel solar bones by mike mccormack is written in only a single sentence 
1k1vf38,todayilearned,2025-04-18 03:29:38,til that hall of fame nhl player red kelly played part of his career while also serving as a member of parliament in the house of commons in canada in the election for his riding he beat another person associated with the nhl player agent and future convicted fraudster alan eagleson 
1k1uzzo,todayilearned,2025-04-18 03:06:00,til from over thousand spanish soldiers fought on the eastern in the blue division a volunteer division made entirely of spanish soldiers they partook in several major battles most notably the siege of leningrad 
1k1v86p,todayilearned,2025-04-18 03:18:53,til of ikota possession of woman in the perm region of russia epidemics had been so widespread ussr officials had sent the party to investigate outbreaks today some scientists believe its a mild form of epilepsy which is a physiological reaction to extreme fright or arctic hysteria 
1k1vne5,todayilearned,2025-04-18 03:42:48,til the cheetahs origins are believed to be in america instead of the big cats populating africa asia and onceeurope the cheetah is more closely related to the puma and the jaguarundi 
1k1uywk,todayilearned,2025-04-18 03:04:18,til one of the leaders of the naacp in the early th century was walter white who was able to pass as white and protect himself during tense situations in the s and s 
1k1uxk4,todayilearned,2025-04-18 03:02:11,til that weird al yankovic doesnt need permission under us copyright law to make a parody of someones song he does so as a personal rule to maintain good relationships 
1k1uvgn,todayilearned,2025-04-18 02:59:03,til about stan latkin who lived for days without a heart while awaiting a transplant 
1k1u8av,todayilearned,2025-04-18 02:24:09,til that there is a superstition dating back to that french presidential candidates who eat the famous omelette de la mre poulard at montsaintmichel win the elections the story roughly translates to eat the omelette and president you will become 
1k1t7zi,todayilearned,2025-04-18 01:29:40,til that during an nyc parade to celebrate jesse owens after he won four gold medals in the summer olympics an anonymous fan handed him a paper bag with in cash 
1k1rgwd,todayilearned,2025-04-17 23:59:27,til general james wilkinson was a highranking us officer during the revolutionary war and war of years after his death historians in spain uncovered proof he had been a spanish spyprompting teddy roosevelt to say in all our history there is no more despicable character 
1k1reip,todayilearned,2025-04-17 23:56:02,til the irukandji jellyfish is tiny almost invisible in the water yet its sting can cause such extreme pain and terror that people experience days of anxiety hallucinations and a feeling of impending death 
1k1r4nl,todayilearned,2025-04-17 23:42:27,til in alva vanderbilt shocked american society by divorcing william k vanderbilt after allegations of adultery alva secured millions received several estates and used her fortune to support womens suffrage efforts to uplift women of all races and champion social and prison reform 
1k1puz2,todayilearned,2025-04-17 22:41:34,til that grapefruit juice can interact in unpredictable ways with many drugs this can occur even when eaten few days before taking the drugs due to the irreversal blocking of critical enzymes needed to metabolize the drug other fruits like citrus apple and pomegranate have similar issues 
1k1p3if,todayilearned,2025-04-17 22:06:20,til in a lobster diver off the coast of cape cod was swallowed entirely by a humpback whale and after seconds spat back out surviving with nonlifethreatening injuries 
1k1olht,todayilearned,2025-04-17 21:43:57,til soda stored in plastic bottles loses to of its carbonation per week due to permeation of carbon dioxide through polyethylene terephthalate pet 
1k1o78d,todayilearned,2025-04-17 21:26:18,til mega warheads candy were invented in s taiwan but it wasnt until the s that they made it to american stores 
1k1nqms,todayilearned,2025-04-17 21:06:24,til bruce springsteens famous song born in the usa is actually a critique of the governments treatment of vietnam war veterans 
1k1l9sc,todayilearned,2025-04-17 19:21:58,til that the girl on the famous uk test card is caorle hersee a costume designer who was featured on the card when she was nine becoming the most aired person in television history appearing on air for over hours 
1k1ks0e,todayilearned,2025-04-17 19:00:48,til after returning from wwii henry ford ii took control of ford and hired young army veterans known as the whiz kids to implement aggressive management control systems this team took the ford from concept to production in months resulting in car orders on day one 
1k1jr1x,todayilearned,2025-04-17 18:17:55,til the s in us civil war general and president ulysses s grant doesnt stand for anything and was a result of a filing error on his application to the united states military academy at west point 
1k1jqdn,todayilearned,2025-04-17 18:17:06,til that almost immediately after its completion leonardo da vincis last supper began to deteriorate in the monastery that held it during world war it would have been destroyed had it not been covered in mattresses and sandbags in case the monastery was bombed 
1k1iz9b,todayilearned,2025-04-17 17:46:40,til after drew barrymore posed nude for playboy in her godfather steven spielberg sent her a note saying cover yourself up along with copies of her pictures altered to make it appear she was fully clothed 
1k1iz21,todayilearned,2025-04-17 17:46:27,til most outlet stores dont sell leftovers from regular storesthey sell cheaper lowerquality versions made just for outlets the compare at prices and big discounts often fake you think youre getting a deal but its not the same product california department of justice 
1k1ics2,todayilearned,2025-04-17 17:21:16,til that napoleon bonaparte has no surviving legitimate descendants but has descendants through his two illegitimate sons charles lon and alexandre colonnawalewski and may have had other illegitimate children 
1k1i0wk,todayilearned,2025-04-17 17:07:54,til that rubies and sapphires are all actually the same gemstone sapphires can come in all sorts of colors even multiples at once its just that when its red we call it a ruby 
1k1gm61,todayilearned,2025-04-17 16:10:10,til that the first recorded use of omg was in a letter to winston churchill from admiral john arbuthnot fisher st baron fisher decades before texting existed 
1k1gejg,todayilearned,2025-04-17 16:01:37,til about walter arnold a british driver who became the first person to get charged for speeding on th january he was driving his car at mph four times the speed limit of mph 
1k1ewin,todayilearned,2025-04-17 14:59:28,til hens dont require a rooster to produce an egg 
1k1en77,todayilearned,2025-04-17 14:48:22,til about the blue diamond affair in which approx kg of saudi royal jewels were stolen by a thai worker in that led to the deaths of several saudi diplomats and businessmen in thailand souring international relations for over years 
1k1czt7,todayilearned,2025-04-17 13:38:00,til about ernie a device introduced by the uk government in to draw premium bond prizes the original ernie used neon tubes and electrons to generate true random numbers and filled up an entire room 
1k1cq9h,todayilearned,2025-04-17 13:25:31,til of the ark a ship hired in to bring english colonists to the province of maryland on its trip over the atlantic wine was passed out to celebrate christmas resulting in people falling ill with fever and people dying 
1k1ch8u,todayilearned,2025-04-17 13:13:54,til that the infamous pacman kill screen is caused by an overflow error causing the game to try and draw pieces of fruit however the code then starts drawing random garbled pieces of memory causing half the screen to get covered in random graphics that the game interprets as fruit 
1k1ch4d,todayilearned,2025-04-17 13:13:44,til alan turing was known for being eccentric each june he would wear a gas mask while cycling to work to block pollen while cycling his bike chain often slipped but instead of fixing it he would count the pedal turns it took before each slip and stop just in time to adjust the chain by hand 
1k1bwn8,todayilearned,2025-04-17 12:46:22,til the lincolndouglas debates in drew crowds of up to peopleeven though they lasted three hours with a hour opening speech a minute rebuttal and a minute closingthe debates were so popular that newspapers printed full transcripts 
1k1blqo,todayilearned,2025-04-17 12:31:00,til two candidates for the paris exhibition were a meter high watering can or guillotine instead the eiffel tower won out 
1k18rd7,todayilearned,2025-04-17 09:38:12,til height surgery is a thing mostly men are enduring months of pain bonebreaking procedures and intense rehab just to get a few inches taller 
1k14m33,todayilearned,2025-04-17 04:44:09,til in sumerian mythology the god enki is believed to have created the tigris and euphrates rivers by masturbating and ejaculating into their empty riverbeds 
1k166op,todayilearned,2025-04-17 06:29:08,til that most planes are painted white to save fuel and reflect sunlight keeping the plane cooler and reducing the need for air conditioning 
1k13g9j,todayilearned,2025-04-17 03:36:11,til about endospores bacteria that can lie dormant in permafrost for over years 
1k121y5,todayilearned,2025-04-17 02:20:01,til before the modern ambulance funeral homes used hearses to bring patients to the hospital this is because the hearse was often the only vehicle long enough to fit a stretcher inside 
1k0yulp,todayilearned,2025-04-16 23:37:55,til there exists an italian exclave within switzerland named campione ditalia it is only one square mile in area and it houses europes largest and oldest casino 
1k0ysoi,todayilearned,2025-04-16 23:35:24,til during the cultural revolution of s china the forbidden city was renamed the palace of blood and tears by the red guards 
1k0uw2m,todayilearned,2025-04-16 20:41:53,til about the use offinnish names in ovamboland namibia due to the historic work of finnish missionaries 
1k0ur7n,todayilearned,2025-04-16 20:36:30,til in serbias unpopular king alexander and queen draga main were brutally assassinated in their bedroom the autocratic king had suspended the constitution multiple times and the couple was loathed by the public and military their bodies were tossed from a balcony in piles of manure 
1k0t54e,todayilearned,2025-04-16 19:29:33,til that the nintendo ds was never meant to replace the game boy line of systems but to act as a third pillar between the game boy advance and the gamecube this was so nintendo could just continue releasing game boys if the ds flopped 
1k0soux,todayilearned,2025-04-16 19:10:49,til that the term fomo fear of missing out was coined by harvard mba student patrick j mcginnis in a article fomo is recognized in psychology as a phenomenon linked to anxiety depression and low selfesteem 
