id,subreddit,created_datetime,full_clean_text
1k3j725,explainlikeimfive,2025-04-20 09:57:03,eli is there a reason acne is much more common on the face in the last years ive never seen a pimple anywhere except on my face whats the reason for our face being much more prone to acne despise all the skincare products why dont we get acne on our handsfingers
1k3ibnn,explainlikeimfive,2025-04-20 08:50:27,eli how do countries devalue their own currency and why would they want to ive read that sometimes countries intentionally devalue their currency but i dont really understand how that works how can a government just decide that its money is worth less dont the markets decide that also why would they want to make their own money weaker wouldnt that just make life more expensive for their people
1k3ib5e,explainlikeimfive,2025-04-20 08:49:25,eli how are phone numbers given is it random or is it orginized
1k3hv4z,explainlikeimfive,2025-04-20 08:15:51,eli why some led bulbs need adapter and others dont i see in my house that i recently bought corridor there is a led light system that has an adapter i think ac to dc but the led bulb in the living room is just connetced directly to socket via power lines can someone explain why some needs adapter and some doesnt and is it really necessary to have that adapter
1k3he3v,explainlikeimfive,2025-04-20 07:41:10,eli does cutting the wrong wire to a bomb really sets cause an explosion like in movies with the circuit cut how is the bomb activating 
1k3h68c,explainlikeimfive,2025-04-20 07:25:13,eli military ranks so ive been trying to figure out what they are and ive done research but im still confused so when im trying to figure out is what are the ranks from highest to lowest to explain to me it would have to be like a count down being the lowest to being the highest rank you can go i dont know much about a lot of things and this is something im still trying to figure out
1k3fjmd,explainlikeimfive,2025-04-20 05:34:42,eli how do scientists know that the sun will last five more billion years 
1k3d6m1,explainlikeimfive,2025-04-20 03:07:21,eli how is the length of the runoffend of the water slide determined how is the length of the runoffend of the water slide determined so in my mind there would be an optimum length for the end of a water slide to stop a human but then when you add a body of semi stationary water that would add resistance reducing the distance required to slow a human to a stop so what would be the calculation the slide that peaked my interest is a single person waterslide sort of like a spiral with a m horizontal section at the end for riders to alight from the slide wish i could attach a picture of it
1k3bs4e,explainlikeimfive,2025-04-20 01:44:43,eli why are small populations doomed to extinction if theres a breeding pair why wouldnt a population survive was reading up about mammoths in the arctic circle and it said once you dip below a certain number the species is doomed why is that couldnt a breeding pair replace the herd given the right circumstances
1k3bo4z,explainlikeimfive,2025-04-20 01:38:21,eli reference point so in general relativity if i take my self as a reference point when i move forward does the whole universe go backward like is the reference point stationary if so then is the force my leg exert enough to move the universe backward
1k3bng0,explainlikeimfive,2025-04-20 01:37:17,eli in terms of economics how exactly do professional sports teams doing well and having success make their teams more valuable 
1k3b9ji,explainlikeimfive,2025-04-20 01:15:14,eli how do we track the coordinates of space junk how do we know where it exists in spacetime and how do astronauts avoid impact i saw this visual on linkedin and since it came from a data source that must mean we have like a location but what how and in d space also do you think if aliens saw earth today theyd believe it has rings like saturn i mean look at the visual its crazy
1k3b916,explainlikeimfive,2025-04-20 01:14:29,eli why does paint fade from sun exposure and why do some fade faster than others 
1k3alxz,explainlikeimfive,2025-04-20 00:40:00,eli what makes fibres stringy i was looking at pictures of the brain and looks stringy find out that the brain is made of fiber cells and that makes me wonder if what makes certain fruits and vegetables like celery so stringy is because of the fiber what makes fiber stringy and what is its function edit typo
1k39b75,explainlikeimfive,2025-04-19 23:31:12,eli what is the functional difference between a v leadacid battery rated for ah and four lithium batteries rated at v mah each wired in series the weight and size difference is very very different between these two but to a person with only surfacelevel knowledge like me they have nearly the same specs context i have a ups tripplite internetu that has a very dead battery ive been playing with the idea of a replacement but i cant for life of me justify spending on a brand new lead acid battery for such a lowperforming ups with no way for me to perform maintenance charges on it but this type of battery is so niche that i cant find any used or refurbed ones i know that li ion is way more dangerous than lead acid when it comes to spontaneous combustion and heat so i will probably not go thru with this but that doesnt mean i dont wanna try it just to see if it actually works but even still i feel like something is telling me that even if i match the aforementioned specs it still wont work as such
1k38sdc,explainlikeimfive,2025-04-19 23:04:50,eli what causes dairy products ie yogurt cottage cheese dip etc to separate when opened and been in the fridge what causes the separation for the water to then arrive on top of the product 
1k38oa7,explainlikeimfive,2025-04-19 22:59:24,eli how comes we cant feel light that might sound stupid but its almost midnight and i just thought if light travels around million metres per second how comes we cant feel it hitting us like i know that photons are proper small and are classed as massless but i would imagine that id feel something hitting me at ms yknow
1k38ies,explainlikeimfive,2025-04-19 22:51:12,eli why do some plants choose to have brown or red colored leaves instead of green 
1k387px,explainlikeimfive,2025-04-19 22:36:28,eli why are oleander bushestrees still allowed in the usa when theyre very toxic 
1k3852e,explainlikeimfive,2025-04-19 22:32:48,eli what is an initial mass function how does it work and how good is the one we currently have came across it while pressing random article on wikipedia i know it has something to do with stars forming and their mass but dont know what the letters and stuff in the function mean
1k37of3,explainlikeimfive,2025-04-19 22:09:49,eli how can nico iamaleava demand more nil money from tennessee if rules state that colleges do not pay the students directly how can nico demand more money from tennessee if the rules of nil say that the money comes from outside sources and in order to maintain their tax exempt status colleges are not allowed to directly pay their athletes but i read articles that say the nil deal is between him and tennessee so i am confused do colleges pay sudents directly or do they just funnel outside money from funders to the athletes how does it work exactly
1k370h6,explainlikeimfive,2025-04-19 21:37:39,eli how can the temp outside be different than the real feel for example i live in phoenix the other day the temperature was reading but it also stated feels like wouldnt that just make it outside
1k36rg4,explainlikeimfive,2025-04-19 21:25:40,eli how have a few religions spread across almost the whole world and have billions of followers 
1k36n1s,explainlikeimfive,2025-04-19 21:19:49,eli interest rate calculation mortgage sorry for the dumb question eli how the interest rate works like say you get a loan with a interest rate i have to pay the loan back plus interest right so i know thats incorrect but none of the websites explain why or show a breakdown of why the cost how does a interest rate on a loan end up being several hundred thousand in interest
1k35t50,explainlikeimfive,2025-04-19 20:40:46,eli what force in a tornado keeps things locked in the vortex instead of being immediately thrown out via centripetal forces i read once about how a tornado picked up a semi and it remained in the vortex a lot longer than i would have anticipated especially since i figured it would have flung tangentially but something kept it in the vortex what is that something
1k34o9l,explainlikeimfive,2025-04-19 19:48:31,eli how do scientists figure out the actual colors of things in space like galaxies and stars 
1k3447q,explainlikeimfive,2025-04-19 19:22:51,eli why arent state governments setup like the federal government where the governor as chief executive appoints all cabinet members such as attorney general secretary of state etc and other key positions like statelevel prosecutors
1k318m0,explainlikeimfive,2025-04-19 17:14:41,eli i have a hard time comprehending the concept of limits in calculus what are limits about i got an explanation its like reading a book where you figure out how itll end even though the last page is missing huh edit thanks everyone who helped me with this with your great explanations if new ones pop up im reading them and theyll help me just as much
1k317sy,explainlikeimfive,2025-04-19 17:13:43,eli why did meghan markle have to quit acting when she became a member of british royalty 
1k2zx82,explainlikeimfive,2025-04-19 16:16:11,eli squirting water in hockey goal posts i dont even know what flair this would fall under at a hockey game i noticed that in downtimes someone would come onto the ice and remove the goal from the two holes that were holding it down they then took a water bottle and squirted water into the hole then put the goal back in place ive rattled my brain as to why but cant think of anything
1k2y6ab,explainlikeimfive,2025-04-19 14:59:49,eli why do people seem to be romantically interested in people that look like their family members idk if this counts as biology but anyways i see those siblings or dating posts and it made me wonder why people date people that somewhat look like their siblings or parents wouldnt that give them a less favorable genetic pool to have kids though how and why does this happen assuming it wouldnt have an evolutionary advantage and why does it seem like people do this unconsciously
1k2xooj,explainlikeimfive,2025-04-19 14:37:03,eli hhow are synthetic elements made in labs i am aware that there are two types of elements natural and syntheticman made how do scientists make them how is it possible please explain it like im actually five if thats not possible then explain it like im
1k2x6jm,explainlikeimfive,2025-04-19 14:13:11,eli the different cricket leagues season structure i understand the game of cricket well for the most part i know theres t odi test but i cant wrap my head around how its all set up soccer each country has a leagueleagues with a pyramid a domestic cup continental cup club world cup and of course the world cup players start as a youth player somewhere promote to a senior team get loanedsold in american sports you go through college get drafted to a team and eventually become a free agent do all the major cricket countries have a cricket league i know india has ipl and australia has bbl i take it theyre like closed franchises like the nfl i saw an article about an auction or something is that crickets version of a draft whos eligible anyone that wants to play in that countrys league are there players that specialize in one discipline whats the calendar like it seems like these t leagues are fairly short is the offseason that long or do they just move over to a testodi team are there even oditest leagues or is it all international teams is there a testodi world cup or also or just the t one and what even is englands system i looked it up on wikipedia and saw it was by counties do you have to be from that county or are the counties just the clubs in the competition hows the pay for a cricket player compared to a soccer player how do they come up is it a youth system like soccer is there a fifa for cricket that organizes all of this
1k2vc2e,explainlikeimfive,2025-04-19 12:38:49,eli professional diploma in the uk what exactly is it hi i was wondering what exactly is a professional diploma in the uk is it the same as a postgraduate diploma what does it lead to is it like a professional qualification that allows you to enter the workforce as a professionalspecialistexpert in a certain field something like associate degrees in the usa ap degrees in denmark or qualification from a hochschule in germany for example thanks in advance for the clarification
1k2uv5w,explainlikeimfive,2025-04-19 12:12:39,eli why can other carnivores eat raw meat but humans are so prone to infections 
1k2sk3a,explainlikeimfive,2025-04-19 09:37:18,eli why do stimulants work differently on people with adhd i know that its because the brain is wired differently but what exactly works different and why do people with adhd get tired when consuming small amounts of ritalinamphetaminescocaine etc
1k2rzby,explainlikeimfive,2025-04-19 08:54:28,eli what are sneaker waves and rip currents are they the same and why are they dangerous saw this on a tiktok video about a dangerous beach but it refused to elaborate and now im trying to figure stuff out
1k2pidm,explainlikeimfive,2025-04-19 05:58:16,eli if every mass in the universe has gravitational effect on space time then why dont everything just crumbled into each other as everything attracts every other things 
1k2pi8m,explainlikeimfive,2025-04-19 05:58:00,eli what is a digital footprint and how would companies find about this 
1k2paui,explainlikeimfive,2025-04-19 05:44:23,eli whats the deal with natural products are they geniunely better or just an appeal to naturalistic fallacy or does it specifically depends on the product lets take the example of skin care products what would be a general view
1k2ncpy,explainlikeimfive,2025-04-19 03:41:22,eli telescopes light speed and mirrors say that there was a mirror in space that was light years away and that mirror bounced back into a telescope b aimed back at earth and it just so happened that there were no debris present to block the telescopes b line of sight to earth would this result in you being able to see earth in the past
1k2l3y6,explainlikeimfive,2025-04-19 01:34:36,eli how does a vein finder work and how to
1k2k2y4,explainlikeimfive,2025-04-19 00:39:32,eli what exactly are rtosisos and how are they driving up energy costs i have some very cursory understanding that generation of energy is different than distribution of energy and that rtos do the latter ive heard that rtos are driving prices of electricity and gas up disincentivizing baseload energy i dont exactly know what that means like coal and nuclear and basically subsidizing wind and solar i do not know enough about it to know if im hearing personal editorials on the topic or if this is legit someone please help me understand
1k2jjrn,explainlikeimfive,2025-04-19 00:11:15,eli how is it possible to lose technology over time like the way romans made concrete when their empire was so vast and had written word 
1k2ib8x,explainlikeimfive,2025-04-18 23:08:59,eli how does your gut gi system adjust to fiber intake the instructions i have on a fiber supplement bottle here are typical emphasis mine new users start with serving per day and gradually increase to desired daily intake generally the implication is that consuming significantly more fiber than you typically do will cause more discomfort presumably from gas than consuming that same amount of fiber would do if that has already been routine for you for some time what is the mechanism involved here in what way and why does a gut microbiome respond differently to a sudden influx of fiber than how a microbiome adapted to that same rate of fiber intake responds to said intake how and why does the latter result in less gas or discomfort
1k2h93u,explainlikeimfive,2025-04-18 22:18:28,eli why do we still have to breathe if our bodies can create energy without oxygen through glycolysis 
1k2g19y,explainlikeimfive,2025-04-18 21:22:54,eli how does homotopy relate to topology i interpreted the formal definition as a set containing points in a topological space defining something
1k2fwai,explainlikeimfive,2025-04-18 21:16:48,eli why is it faster to build muscle if youve been muscular before when a fit person stops working out the defined muscles will fade and eventually seem to disappear so why is it possible to build the same amount of muscle faster when returning from a break how long can a break from working out actually be without having to start from scratch again
1k2bmki,explainlikeimfive,2025-04-18 18:13:32,eli how emdr works how can eye movement improve mental health that drastically
1k2akm7,explainlikeimfive,2025-04-18 17:29:09,eli why does sense of balance worsen as people get older 
1k29b7i,explainlikeimfive,2025-04-18 16:36:49,eli if black holes are singularities why do they have such large diameters if black holes are singularities why do they have such large diameters
1k296te,explainlikeimfive,2025-04-18 16:31:40,eli how are the values of irrational numbers calculated how did they determine the values of numbers like pi or e to so many decimal places
1k27hl2,explainlikeimfive,2025-04-18 15:20:03,eli why do some countries forbid you from being a citizen of multiple countries at once 
1k24k1y,explainlikeimfive,2025-04-18 13:10:07,eli what stops a mm grenade from detonating if you spin it like a top so i know a mm grenade wont detonate until its spun a certain amount of times in flight distance is usually meters i think so what stops someone from picking one up and spinning it around and having it blow up in their face
1k24chd,explainlikeimfive,2025-04-18 13:00:14,eli if globally acquittal rate is so low then why is defence lawyer cosidered a good job why would someone consider becoming a defence attorney apart from passion or something
1k24bnq,explainlikeimfive,2025-04-18 12:59:06,eli why is the puss caterpillar so venomous but the adult moth it turns into is completely harmless the puss caterpillar is covered in venomous spines that can mess you up just by touching it but then it turns into this soft fuzzy little moth the southern flannel moth that doesnt have any defenses at all so how and why does it start off so dangerous and end up so chill
1k243no,explainlikeimfive,2025-04-18 12:47:46,eli how do inverse opal structures work and how can i incorporate them in a compound mates how do inverse opal structures work and is there any possible way to change a compounds structure into an inverse opal one and observe the changes in its behaviouris there a way to simulate this at a very simple level
1k23u69,explainlikeimfive,2025-04-18 12:34:05,eli galileos famous thought experiment so one can understand the independence of gravitational acceleration from mass 
1k22lr0,explainlikeimfive,2025-04-18 11:26:21,eli ive heard artificial sweeteners can raise blood sugar how is this possible where is the extra sugar coming from 
1k21nxz,explainlikeimfive,2025-04-18 10:27:53,eli why is the james webb space telescope viewing measured in age vs distance everything i have read seems to explain or state that the telescope can see an object that is a certain amount of years old it does seem to state how far away the object is but it seems as though the capabilities of what it can see is measured in age
1k1zu32,explainlikeimfive,2025-04-18 08:18:32,eli physics tell us that a surface emits the colors that it cannot absorb does that mean a blue flower is everything but blue havent studied physics in years just wondering also does the same concept work for animal skin skin being the surface edit reflects
1k1ztwh,explainlikeimfive,2025-04-18 08:18:10,eli are all over weight people insulin resistant is obesity the biggest tell tale sign of ir please explain im a pt and feel like im going down a rabbit hole
1k1ytf2,explainlikeimfive,2025-04-18 07:04:38,eli why in north america are many so many foods at stores and restaurants often sold by volume and less often by their mass 
1k1yjrp,explainlikeimfive,2025-04-18 06:46:20,eli why do we inject adrenaline epi pen into someone having an allergic reaction whats the mechanism behind an adrenaline injection eg epi pen saving someone with a serious allergic reaction
1k1y8vi,explainlikeimfive,2025-04-18 06:25:46,eli why do geologists say a certain rock is some number millions or billions of years old when all the rock on earth is from the same initial source 
1k1xxdl,explainlikeimfive,2025-04-18 06:04:08,eli why is the tongue such a strong muscle what is the evolutionary advantage is having such a strong tongue i understand for birds they use their tongue to break seeds open but humans or omnivores have their teeth or their hands
1k1xx4a,explainlikeimfive,2025-04-18 06:03:37,eli the workout paradox dreading the start loving the finish can someone please explain this does anyone else struggle like this is this normal almost every time i plan to work out i have to seriously push myself just to get started i drag my feet make excuses and battle with my own mind but then once i do the workout and finish i feel incredibleenergized clearheaded and proud i always think that felt amazing im definitely doing this again tomorrow and yet when the next day comes its like i forgot all of that im back to square one trying to convince myself to get up and move why is it so hard to start even when i know how great its going to feel afterward
1k1x8da,explainlikeimfive,2025-04-18 05:18:26,eli is it true magenta and cyan are the true primary colors not red yellow and blue 
1k1wy08,explainlikeimfive,2025-04-18 05:00:03,eli how can vvt variable valve timing boost a combustion engines performance i understand a spark advance can give an engine more time to burn its fuel to get more power but i dont see how adjusting the moment at which the valves open or close can also boost performance
1k1wok6,explainlikeimfive,2025-04-18 04:43:30,eli how is it a text message from across the world arrives in a minute 
1k1wd9l,explainlikeimfive,2025-04-18 04:24:18,eli or maybe why is the speed of light the fastest you can go i know its the speed of causality but i dont know what that actually means or why that is
1k1w1ev,explainlikeimfive,2025-04-18 04:04:57,eli how does the planet get colder i understand that winter happens because part of the planet gets less sunlight for part of the year due to axial tilt i also understand that the tropics get more sunlight while the poles get less i understand that planets that are further from the sun are often colder and those closer to the sun are warmer what i dont fully understand is how the planet can cool off after its already warm its in space theres nothing for the molecules to rub against thats why spaceships need radiators to cool off so once its hot wouldnt it stay hot forever i vaguely remember something as a child about infrared radiation escaping the atmosphere but im really not sure how heat turns into light like that nor am i fully convinced that would even be efficient enough to chill the planet that quickly but i could easily be wrong
1k1vl21,explainlikeimfive,2025-04-18 03:39:06,eli what are interest rates and why do countries increase or decrease it i understand what an interest is when someone takes a loan but in the broader sense when we talk about a nations interest rate what does that mean
1k1uwqq,explainlikeimfive,2025-04-18 03:00:56,eli how does ozempic cause weight loss 
1k1tzq4,explainlikeimfive,2025-04-18 02:11:11,eli why does muscle shrink after taking a break from the gym last year i started to get in shape i am foot and started out at lb and got up to lb i was super skinny so i decided to become an avid gym goer for the better part of six months i was not big by any means but definitely looked better in january i went on vacation came back took two months off to focus on career development in february i broke my hand and completely after that i forgot about the gym during my healing process im not longer lean my muscles arent pronounced and i just look average now im at pounds and havent been to the gym since the last week of december i know i dont eat no where near as much as i used to which plays a factor but what cases the muscle to shrink
1k1tnzc,explainlikeimfive,2025-04-18 01:53:39,eli why do quantum computers have to be almost as cold as outer space my laptop works fine at room temperature but ive heard real quantum computers need to be cooled down to just a few hundredths of a degree above absolute zero colder than antarctica why cant they just work warm like regular processors and wont they generate heat as well how is this so precisely controlled
1k1shhf,explainlikeimfive,2025-04-18 00:51:13,eli when graphing the correlation between gravity and the passing of time what function is used as i understand it from the theory of general relativity increased gravity means time moves more slowly i was wondering if this was linear logarithmic exponential etc when graphing the correlation is there a formula that can measure the relative passing of time based on differences in gravity presumably using earths gravity as a baseline from a quick google search googles ai said it was an exponential function if true why does it behave that way are there any known or theoretical places in our observable universe with no gravitational influences what would the passing of time look like in such a place thanks so much
1k1qmsi,explainlikeimfive,2025-04-17 23:18:15,eli how are we able to detect life on planets from so far away we all read about the new exoplanet k b seemingly having molecules associated with life i know it has to do with the local stars light passing through the planet but thats the extent of my knowledge
